{
  "schemaVersion": "1.0.0",
  "mode": "development",
  "reelId": "R-ai-shared-body-fixture-h3",
  "topicId": "ai-shared-body-fixture",
  "hookNumber": 3,
  "scriptVersion": 1,
  "hookText": "Одна нейросеть может отвечать твоим клиентам вместо тебя. Показываю как.",
  "scriptText": "Одна нейросеть может отвечать твоим клиентам вместо тебя. Показываю как.\n\nКаждый день тебе пишут клиенты в почту, в Telegram, в WhatsApp, в чат на сайте, в комментарии и на ответы уходит половина дня. Попробуй так. Скопируй сообщение клиентов к Claude и напиши ответ коротко, вежливо в моем стиле. Предложи созвон на четверг. 10 секунд и ответ готов. Тебя остается только проверить и отправить. Также можно с отзывами, заявками с сайта, коммерческими предложениями и договорами. Напиши в комментариях, где ты общаешься со своими клиентами и в следующем видео я разберу это подробнее.",
  "approvalStatus": "pending_approval",
  "productionStatus": "transcribed",
  "sourceVideo": {
    "localPath": "rr/incoming/shared-body-test/R-ai-shared-body-fixture-h3.mp4",
    "sha256": "43f9c35bb85404dda2b6edb33edaed24c3a6afebbd3da8dd005e45922e69814a",
    "duration": 38.48,
    "width": 1080,
    "height": 1920,
    "fps": 25.0,
    "origin": "repository_fixture"
  },
  "wordTimings": [
    {
      "text": "Одна",
      "start": 0.0,
      "end": 0.6
    },
    {
      "text": "нейросеть",
      "start": 0.6,
      "end": 1.14
    },
    {
      "text": "может",
      "start": 1.14,
      "end": 1.36
    },
    {
      "text": "отвечать",
      "start": 1.36,
      "end": 1.9
    },
    {
      "text": "твоим",
      "start": 1.9,
      "end": 2.24
    },
    {
      "text": "клиентам",
      "start": 2.24,
      "end": 2.76
    },
    {
      "text": "вместо",
      "start": 2.76,
      "end": 3.1
    },
    {
      "text": "тебя.",
      "start": 3.1,
      "end": 3.38
    },
    {
      "text": "Показываю",
      "start": 3.64,
      "end": 4.22
    },
    {
      "text": "как.",
      "start": 4.22,
      "end": 4.36
    },
    {
      "text": "Каждый",
      "start": 5.060758,
      "end": 5.361515
    },
    {
      "text": "день",
      "start": 5.401616,
      "end": 5.56202
    },
    {
      "text": "тебе",
      "start": 5.602121,
      "end": 5.742475
    },
    {
      "text": "пишут",
      "start": 5.822677,
      "end": 6.043232
    },
    {
      "text": "клиенты",
      "start": 6.103384,
      "end": 6.524444
    },
    {
      "text": "в",
      "start": 6.624697,
      "end": 6.644747
    },
    {
      "text": "почту,",
      "start": 6.704899,
      "end": 7.085859
    },
    {
      "text": "в",
      "start": 7.206162,
      "end": 7.226212
    },
    {
      "text": "Telegram,",
      "start": 7.266313,
      "end": 7.767576
    },
    {
      "text": "в",
      "start": 8.248788,
      "end": 8.268838
    },
    {
      "text": "WhatsApp,",
      "start": 8.308939,
      "end": 8.770101
    },
    {
      "text": "в",
      "start": 8.950556,
      "end": 8.990657
    },
    {
      "text": "чат",
      "start": 9.050808,
      "end": 9.231263
    },
    {
      "text": "на",
      "start": 9.291414,
      "end": 9.331515
    },
    {
      "text": "сайте,",
      "start": 9.451818,
      "end": 9.752576
    },
    {
      "text": "в",
      "start": 9.892929,
      "end": 9.91298
    },
    {
      "text": "комментарии",
      "start": 9.953081,
      "end": 10.494444
    },
    {
      "text": "и",
      "start": 11.09596,
      "end": 11.11601
    },
    {
      "text": "на",
      "start": 11.276414,
      "end": 11.316515
    },
    {
      "text": "ответы",
      "start": 11.396717,
      "end": 11.697475
    },
    {
      "text": "уходит",
      "start": 11.757626,
      "end": 12.058384
    },
    {
      "text": "половина",
      "start": 12.138586,
      "end": 12.499495
    },
    {
      "text": "дня.",
      "start": 12.559646,
      "end": 12.659899
    },
    {
      "text": "Попробуй",
      "start": 13.24,
      "end": 13.64
    },
    {
      "text": "так.",
      "start": 13.64,
      "end": 13.84
    },
    {
      "text": "Скопируй",
      "start": 14.36,
      "end": 14.8
    },
    {
      "text": "сообщение",
      "start": 14.8,
      "end": 15.28
    },
    {
      "text": "клиентов",
      "start": 15.28,
      "end": 15.8
    },
    {
      "text": "к",
      "start": 15.8,
      "end": 16.0
    },
    {
      "text": "Claude",
      "start": 16.0,
      "end": 16.22
    },
    {
      "text": "и",
      "start": 16.22,
      "end": 16.72
    },
    {
      "text": "напиши",
      "start": 16.72,
      "end": 17.1
    },
    {
      "text": "ответ",
      "start": 17.1,
      "end": 17.3
    },
    {
      "text": "коротко,",
      "start": 17.3,
      "end": 18.0
    },
    {
      "text": "вежливо",
      "start": 18.32,
      "end": 18.76
    },
    {
      "text": "в",
      "start": 18.76,
      "end": 19.06
    },
    {
      "text": "моем",
      "start": 19.06,
      "end": 19.3
    },
    {
      "text": "стиле.",
      "start": 19.3,
      "end": 19.78
    },
    {
      "text": "Предложи",
      "start": 20.08,
      "end": 20.54
    },
    {
      "text": "созвон",
      "start": 20.54,
      "end": 20.88
    },
    {
      "text": "на",
      "start": 20.88,
      "end": 21.04
    },
    {
      "text": "четверг.",
      "start": 21.04,
      "end": 21.52
    },
    {
      "text": "10",
      "start": 21.88,
      "end": 22.2
    },
    {
      "text": "секунд",
      "start": 22.2,
      "end": 22.86
    },
    {
      "text": "и",
      "start": 22.86,
      "end": 23.04
    },
    {
      "text": "ответ",
      "start": 23.04,
      "end": 23.22
    },
    {
      "text": "готов.",
      "start": 23.22,
      "end": 23.5
    },
    {
      "text": "Тебя",
      "start": 24.02,
      "end": 24.24
    },
    {
      "text": "остается",
      "start": 24.24,
      "end": 24.64
    },
    {
      "text": "только",
      "start": 24.64,
      "end": 24.88
    },
    {
      "text": "проверить",
      "start": 24.88,
      "end": 25.5
    },
    {
      "text": "и",
      "start": 25.5,
      "end": 25.8
    },
    {
      "text": "отправить.",
      "start": 25.8,
      "end": 26.26
    },
    {
      "text": "Также",
      "start": 26.72,
      "end": 26.96
    },
    {
      "text": "можно",
      "start": 26.96,
      "end": 27.22
    },
    {
      "text": "с",
      "start": 27.22,
      "end": 27.5
    },
    {
      "text": "отзывами,",
      "start": 27.5,
      "end": 27.96
    },
    {
      "text": "заявками",
      "start": 28.28,
      "end": 28.8
    },
    {
      "text": "с",
      "start": 28.8,
      "end": 28.98
    },
    {
      "text": "сайта,",
      "start": 28.98,
      "end": 29.28
    },
    {
      "text": "коммерческими",
      "start": 29.68,
      "end": 30.26
    },
    {
      "text": "предложениями",
      "start": 30.26,
      "end": 31.08
    },
    {
      "text": "и",
      "start": 31.08,
      "end": 31.3
    },
    {
      "text": "договорами.",
      "start": 31.3,
      "end": 31.86
    },
    {
      "text": "Напиши",
      "start": 31.86,
      "end": 32.72
    },
    {
      "text": "в",
      "start": 32.72,
      "end": 32.76
    },
    {
      "text": "комментариях,",
      "start": 32.76,
      "end": 33.44
    },
    {
      "text": "где",
      "start": 33.6,
      "end": 33.7
    },
    {
      "text": "ты",
      "start": 33.7,
      "end": 33.84
    },
    {
      "text": "общаешься",
      "start": 33.84,
      "end": 34.44
    },
    {
      "text": "со",
      "start": 34.44,
      "end": 34.56
    },
    {
      "text": "своими",
      "start": 34.56,
      "end": 34.86
    },
    {
      "text": "клиентами",
      "start": 34.86,
      "end": 35.38
    },
    {
      "text": "и",
      "start": 35.38,
      "end": 35.96
    },
    {
      "text": "в",
      "start": 35.96,
      "end": 36.1
    },
    {
      "text": "следующем",
      "start": 36.1,
      "end": 36.54
    },
    {
      "text": "видео",
      "start": 36.54,
      "end": 36.74
    },
    {
      "text": "я",
      "start": 36.74,
      "end": 37.08
    },
    {
      "text": "разберу",
      "start": 37.08,
      "end": 37.42
    },
    {
      "text": "это",
      "start": 37.42,
      "end": 37.58
    },
    {
      "text": "подробнее.",
      "start": 37.58,
      "end": 38.08
    }
  ],
  "speechSegments": [
    {
      "text": "Одна нейросеть может отвечать твоим клиентам вместо",
      "start": 0.0,
      "end": 3.1
    },
    {
      "text": "тебя.",
      "start": 3.1,
      "end": 3.38
    },
    {
      "text": "Показываю как.",
      "start": 3.64,
      "end": 4.36
    },
    {
      "text": "Каждый день тебе пишут клиенты в почту, в Telegram, в WhatsApp, в чат на сайте, в комментарии и на ответы уходит половина дня.",
      "start": 4.76,
      "end": 12.7
    },
    {
      "text": "Попробуй так. Скопируй сообщение клиентов к Claude и напиши ответ коротко, вежливо в моем стиле.",
      "start": 13.24,
      "end": 19.78
    },
    {
      "text": "Предложи созвон на четверг. 10 секунд и ответ готов.",
      "start": 20.08,
      "end": 23.5
    },
    {
      "text": "Тебя остается только проверить и отправить.",
      "start": 24.02,
      "end": 26.26
    },
    {
      "text": "Также можно с отзывами, заявками с сайта, коммерческими предложениями и договорами.",
      "start": 26.72,
      "end": 31.86
    },
    {
      "text": "Напиши в комментариях, где ты общаешься со своими",
      "start": 31.86,
      "end": 34.86
    },
    {
      "text": "клиентами и в следующем видео я разберу это подробнее.",
      "start": 34.86,
      "end": 38.08
    }
  ],
  "scriptHash": "d63828d0e82b8c8f2ff729e4cace6eaa7cbd6f9fa40cbde1b189fe5d5c9568fa"
}
